
    =========================== USB Port1 ===========================

Connection Status        : 0x01 (Device is connected)
Port Chain               : 1-1
Properties               : 0x01
 IsUserConnectable       : yes
 PortIsDebugCapable      : no
 PortHasMultiCompanions  : no
 PortConnectorIsTypeC    : no
ConnectionIndex          : 0x01 (Port 1)
CompanionIndex           : 0
 CompanionHubSymLnk      : USB#ROOT_HUB30#4&1fede82&0&0#{f18a0e88-c30c-11d0-8815-00a0c906bed8}
 CompanionPortNumber     : 0x17 (Port 23)
 -> CompanionPortChain   : 1-23

      ========================== Summary =========================
Vendor ID                : 0x056E (Elecom Co., Ltd.)
Product ID               : 0x2010
Manufacturer String      : ELECOM
Product String           : JC-U4113S DirectInput Mode
Serial                   : ---
USB Version              : 1.1
Port maximum Speed       : High-Speed (Companion Port 1-23 is doing the SuperSpeed)
Device maximum Speed     : Full-Speed
Device Connection Speed  : Full-Speed
Self powered             : no
Demanded Current         : 100 mA
Used Endpoints           : 3

      ======================== USB Device ========================

        +++++++++++++++++ Device Information ++++++++++++++++++
Device Description       : USB 入力デバイス
Device Path              : \\?\USB#VID_056E&PID_2010#5&224c6610&0&1#{a5dcbf10-6530-11d2-901f-00c04fb951ed} (GUID_DEVINTERFACE_USB_DEVICE)
Kernel Name              : \Device\USBPDO-7
Device ID                : USB\VID_056E&PID_2010\5&224C6610&0&1
Hardware IDs             : USB\VID_056E&PID_2010&REV_1001 USB\VID_056E&PID_2010
Driver KeyName           : {745a17a0-74d3-11d0-b6fe-00a0c90f57da}\0009 (GUID_DEVCLASS_HIDCLASS)
Driver                   : \SystemRoot\System32\drivers\hidusb.sys (Version: 10.0.26100.3624  Date: 2025-04-09  Company: Microsoft Corporation)
Driver Inf               : C:\Windows\inf\input.inf
Legacy BusType           : PNPBus
Class                    : HIDClass
Class GUID               : {745a17a0-74d3-11d0-b6fe-00a0c90f57da} (GUID_DEVCLASS_HIDCLASS)
Service                  : HidUsb
Enumerator               : USB
Location Info            : Port_#0001.Hub_#0001
Address                  : 1
Location IDs             : PCIROOT(0)#PCI(1400)#USBROOT(0)#USB(1), ACPI(_SB_)#ACPI(PC00)#ACPI(XHCI)#ACPI(RHUB)#ACPI(HS01)
Container ID             : {a53c6783-06d9-11f0-8297-f0d415dad9b3}
Manufacturer Info        : (標準システム デバイス)
Capabilities             : 0x84 (Removable, SurpriseRemovalOK)
Status                   : 0x0180600A (DN_DRIVER_LOADED, DN_STARTED, DN_DISABLEABLE, DN_REMOVABLE, DN_NT_ENUMERATOR, DN_NT_DRIVER)
Problem Code             : 0
SelectiveSuspendEnabled  : 0
EnhancedPowerMgmtEnabled : 1
Power State              : D0 (supported: D0, D3, wake from D0)

        ---------------- Connection Information ---------------
Connection Index         : 0x01 (Port 1)
Connection Status        : 0x01 (DeviceConnected)
Current Config Value     : 0x01 (Configuration 1)
Device Address           : 0x0B (11)
Is Hub                   : 0x00 (no)
Device Bus Speed         : 0x01 (Full-Speed)
Number of open Pipes     : 0x02 (2 pipes to data endpoints)
Pipe[0]                  : EndpointID=2  Direction=OUT  ScheduleOffset=0  Type=Interrupt  wMaxPacketSize=0x40    bInterval=10  -> 718 Bits/ms = 89750 Bytes/s
Pipe[1]                  : EndpointID=1  Direction=IN   ScheduleOffset=0  Type=Interrupt  wMaxPacketSize=0x40    bInterval=10  -> 718 Bits/ms = 89750 Bytes/s
Data (HexDump)           : 01 00 00 00 12 01 10 01 00 00 00 40 6E 05 10 20   ...........@n.. 
                           01 10 01 02 00 01 01 01 00 0B 00 02 00 00 00 01   ................
                           00 00 00 07 05 02 03 40 00 0A 00 00 00 00 07 05   .......@........
                           81 03 40 00 0A 00 00 00 00                        ..@......

        --------------- Connection Information V2 -------------
Connection Index         : 0x01 (1)
Length                   : 0x10 (16 bytes)
SupportedUsbProtocols    : 0x03
 Usb110                  : 1 (yes, port supports USB 1.1)
 Usb200                  : 1 (yes, port supports USB 2.0)
 Usb300                  : 0 (no, port not supports USB 3.0) -> but Companion Port 1-23 does
 ReservedMBZ             : 0x00
Flags                    : 0x00
 DevIsOpAtSsOrHigher     : 0 (Device is not operating at SuperSpeed or higher)
 DevIsSsCapOrHigher      : 0 (Device is not SuperSpeed capable or higher)
 DevIsOpAtSsPlusOrHigher : 0 (Device is not operating at SuperSpeedPlus or higher)
 DevIsSsPlusCapOrHigher  : 0 (Device is not SuperSpeedPlus capable or higher)
 ReservedMBZ             : 0x00
Data (HexDump)           : 01 00 00 00 10 00 00 00 03 00 00 00 00 00 00 00   ................

    ---------------------- Device Descriptor ----------------------
bLength                  : 0x12 (18 bytes)
bDescriptorType          : 0x01 (Device Descriptor)
bcdUSB                   : 0x110 (USB Version 1.1)
bDeviceClass             : 0x00 (defined by the interface descriptors)
bDeviceSubClass          : 0x00
bDeviceProtocol          : 0x00
bMaxPacketSize0          : 0x40 (64 bytes)
idVendor                 : 0x056E (Elecom Co., Ltd.)
idProduct                : 0x2010
bcdDevice                : 0x1001
iManufacturer            : 0x01 (String Descriptor 1)
 Language 0x0409         : "ELECOM"
iProduct                 : 0x02 (String Descriptor 2)
 Language 0x0409         : "JC-U4113S DirectInput Mode"
iSerialNumber            : 0x00 (No String Descriptor)
bNumConfigurations       : 0x01 (1 Configuration)
Data (HexDump)           : 12 01 10 01 00 00 00 40 6E 05 10 20 01 10 01 02   .......@n.. ....
                           00 01                                             ..

    ------------------ Configuration Descriptor -------------------
bLength                  : 0x09 (9 bytes)
bDescriptorType          : 0x02 (Configuration Descriptor)
wTotalLength             : 0x0029 (41 bytes)
bNumInterfaces           : 0x01 (1 Interface)
bConfigurationValue      : 0x01 (Configuration 1)
iConfiguration           : 0x00 (No String Descriptor)
bmAttributes             : 0x80
 D7: Reserved, set 1     : 0x01
 D6: Self Powered        : 0x00 (no)
 D5: Remote Wakeup       : 0x00 (no)
 D4..0: Reserved, set 0  : 0x00
MaxPower                 : 0x32 (100 mA)
Data (HexDump)           : 09 02 29 00 01 01 00 80 32 09 04 00 00 02 03 00   ..).....2.......
                           00 00 09 21 10 01 00 01 22 52 00 07 05 02 03 40   ...!...."R.....@
                           00 0A 07 05 81 03 40 00 0A                        ......@..

        ---------------- Interface Descriptor -----------------
bLength                  : 0x09 (9 bytes)
bDescriptorType          : 0x04 (Interface Descriptor)
bInterfaceNumber         : 0x00 (Interface 0)
bAlternateSetting        : 0x00
bNumEndpoints            : 0x02 (2 Endpoints)
bInterfaceClass          : 0x03 (HID - Human Interface Device)
bInterfaceSubClass       : 0x00 (None)
bInterfaceProtocol       : 0x00 (None)
iInterface               : 0x00 (No String Descriptor)
Data (HexDump)           : 09 04 00 00 02 03 00 00 00                        .........

        ------------------- HID Descriptor --------------------
bLength                  : 0x09 (9 bytes)
bDescriptorType          : 0x21 (HID Descriptor)
bcdHID                   : 0x0110 (HID Version 1.10)
bCountryCode             : 0x00 (00 = not localized)
bNumDescriptors          : 0x01
Data (HexDump)           : 09 21 10 01 00 01 22 52 00                        .!...."R.
Descriptor 1:
bDescriptorType          : 0x22 (Class=Report)
wDescriptorLength        : 0x0052 (82 bytes)
  05 01             Usage Page (Generic Desktop Controls)
  09 05             Usage (Gamepad)
  A1 01             Collection (Application)
  15 00               Logical Minimum (0)
  25 01               Logical Maximum (1)
  35 00               Physical Minimum (0)
  45 01               Physical Maximum (1)
  75 01               Report Size (1)
  95 0D               Report Count (13)
  05 09               Usage Page (Buttons)
  19 01               Usage Minimum (1)
  29 0D               Usage Maximum (13)
  81 02               Input (Var)
  95 07               Report Count (7)
  81 01               Input (Const)
  05 01               Usage Page (Generic Desktop Controls)
  25 07               Logical Maximum (7)
  46 3B 01            Physical Maximum (315)
  75 04               Report Size (4)
  95 01               Report Count (1)
  65 14               Unit (0x14)
  09 39               Usage (Hat Switch)
  81 42               Input (Var, NullState)
  26 FF 00            Logical Maximum (255)
  46 FF 00            Physical Maximum (255)
  09 30               Usage (Direction-X)
  09 31               Usage (Direction-Y)
  09 32               Usage (Direction-Z)
  09 35               Usage (Rotate-Z)
  75 08               Report Size (8)
  95 04               Report Count (4)
  81 02               Input (Var)
  75 08               Report Size (8)
  95 08               Report Count (8)
  26 FF 00            Logical Maximum (255)
  46 FF 00            Physical Maximum (255)
  09 0E               Usage (unk)
  91 02               Output (Var)
  C0                End Collection
Data (HexDump)           : 05 01 09 05 A1 01 15 00 25 01 35 00 45 01 75 01   ........%.5.E.u.
                           95 0D 05 09 19 01 29 0D 81 02 95 07 81 01 05 01   ......).........
                           25 07 46 3B 01 75 04 95 01 65 14 09 39 81 42 26   %.F;.u...e..9.B&
                           FF 00 46 FF 00 09 30 09 31 09 32 09 35 75 08 95   ..F...0.1.2.5u..
                           04 81 02 75 08 95 08 26 FF 00 46 FF 00 09 0E 91   ...u...&..F.....
                           02 C0                                             ..

        ----------------- Endpoint Descriptor -----------------
bLength                  : 0x07 (7 bytes)
bDescriptorType          : 0x05 (Endpoint Descriptor)
bEndpointAddress         : 0x02 (Direction=OUT EndpointID=2)
bmAttributes             : 0x03 (TransferType=Interrupt)
wMaxPacketSize           : 0x0040 (64 bytes)
bInterval                : 0x0A (10 ms)
Data (HexDump)           : 07 05 02 03 40 00 0A                              ....@..

        ----------------- Endpoint Descriptor -----------------
bLength                  : 0x07 (7 bytes)
bDescriptorType          : 0x05 (Endpoint Descriptor)
bEndpointAddress         : 0x81 (Direction=IN EndpointID=1)
bmAttributes             : 0x03 (TransferType=Interrupt)
wMaxPacketSize           : 0x0040 (64 bytes)
bInterval                : 0x0A (10 ms)
Data (HexDump)           : 07 05 81 03 40 00 0A                              ....@..

      -------------------- String Descriptors -------------------
             ------ String Descriptor 0 ------
bLength                  : 0x04 (4 bytes)
bDescriptorType          : 0x03 (String Descriptor)
Language ID[0]           : 0x0409 (English - United States)
Data (HexDump)           : 04 03 09 04                                       ....
             ------ String Descriptor 1 ------
bLength                  : 0x0E (14 bytes)
bDescriptorType          : 0x03 (String Descriptor)
Language 0x0409          : "ELECOM"
Data (HexDump)           : 0E 03 45 00 4C 00 45 00 43 00 4F 00 4D 00         ..E.L.E.C.O.M.
             ------ String Descriptor 2 ------
bLength                  : 0x36 (54 bytes)
bDescriptorType          : 0x03 (String Descriptor)
Language 0x0409          : "JC-U4113S DirectInput Mode"
Data (HexDump)           : 36 03 4A 00 43 00 2D 00 55 00 34 00 31 00 31 00   6.J.C.-.U.4.1.1.
                           33 00 53 00 20 00 44 00 69 00 72 00 65 00 63 00   3.S. .D.i.r.e.c.
                           74 00 49 00 6E 00 70 00 75 00 74 00 20 00 4D 00   t.I.n.p.u.t. .M.
                           6F 00 64 00 65 00                                 o.d.e.
