
    =========================== USB Port1 ===========================

Connection Status        : 0x01 (Device is connected)
Port Chain               : 1-1
Properties               : 0x01
 IsUserConnectable       : yes
 PortIsDebugCapable      : no
 PortHasMultiCompanions  : no
 PortConnectorIsTypeC    : no
ConnectionIndex          : 0x01 (Port 1)
CompanionIndex           : 0
 CompanionHubSymLnk      : USB#ROOT_HUB30#4&1fede82&0&0#{f18a0e88-c30c-11d0-8815-00a0c906bed8}
 CompanionPortNumber     : 0x17 (Port 23)
 -> CompanionPortChain   : 1-23

      ========================== Summary =========================
Vendor ID                : 0x046D (Logitech Inc.)
Product ID               : 0xC21D
Manufacturer String      : Logicool
Product String           : Gamepad F310
Serial                   : 9195F557
USB Version              : 2.0 -> but Device is Full-Speed only
Port maximum Speed       : High-Speed (Companion Port 1-23 is doing the SuperSpeed)
Device maximum Speed     : Full-Speed
Device Connection Speed  : Full-Speed
Self powered             : no
Demanded Current         : 500 mA
Used Endpoints           : 3

      ======================== USB Device ========================

        +++++++++++++++++ Device Information ++++++++++++++++++
Device Description       : XBOX 360 Controller For Windows
Device Path 1            : \\?\USB#VID_046D&PID_C21D#9195F557#{a5dcbf10-6530-11d2-901f-00c04fb951ed} (GUID_DEVINTERFACE_USB_DEVICE)
Device Path 2            : \\?\USB#VID_046D&PID_C21D#9195F557#{ec87f1e3-c13b-4100-b5f7-8b84d54260cb}
Kernel Name              : \Device\USBPDO-6
Device ID                : USB\VID_046D&PID_C21D\9195F557
Hardware IDs             : USB\VID_046D&PID_C21D&REV_4014 USB\VID_046D&PID_C21D
Driver KeyName           : {d61ca365-5af4-4486-998b-9db4734c6ca3}\0002
Driver                   : \SystemRoot\System32\drivers\xusb22.sys (Version: 10.0.26100.3624  Date: 2025-04-09  Company: Microsoft Corporation)
Driver Inf               : C:\Windows\inf\xusb22.inf
Legacy BusType           : PNPBus
Class                    : XnaComposite
Class GUID               : {d61ca365-5af4-4486-998b-9db4734c6ca3}
Service                  : xusb22
Enumerator               : USB
Location Info            : Port_#0001.Hub_#0001
Address                  : 1
Location IDs             : PCIROOT(0)#PCI(1400)#USBROOT(0)#USB(1), ACPI(_SB_)#ACPI(PC00)#ACPI(XHCI)#ACPI(RHUB)#ACPI(HS01)
Container ID             : {71ffd75f-73f1-597b-bc65-2e6eaa21e215}
Manufacturer Info        : Microsoft
Capabilities             : 0x94 (Removable, UniqueID, SurpriseRemovalOK)
Status                   : 0x0180600A (DN_DRIVER_LOADED, DN_STARTED, DN_DISABLEABLE, DN_REMOVABLE, DN_NT_ENUMERATOR, DN_NT_DRIVER)
Problem Code             : 0
EnhancedPowerMgmtEnabled : 0
Power State              : D0 (supported: D0, D3, wake from D0)

        +++++++++++++++++ Registry USB Flags +++++++++++++++++
HKEY_LOCAL_MACHINE\SYSTEM\CurrentControlSet\Control\usbflags\046DC21D4014
 osvc                    : REG_BINARY 01 90
 SkipContainerIdQuery    : REG_BINARY 01 00

        ---------------- Connection Information ---------------
Connection Index         : 0x01 (Port 1)
Connection Status        : 0x01 (DeviceConnected)
Current Config Value     : 0x01 (Configuration 1)
Device Address           : 0x06 (6)
Is Hub                   : 0x00 (no)
Device Bus Speed         : 0x01 (Full-Speed)
Number of open Pipes     : 0x02 (2 pipes to data endpoints)
Pipe[0]                  : EndpointID=1  Direction=IN   ScheduleOffset=0  Type=Interrupt  wMaxPacketSize=0x20    bInterval=4   -> 420 Bits/ms = 52500 Bytes/s
Pipe[1]                  : EndpointID=2  Direction=OUT  ScheduleOffset=0  Type=Interrupt  wMaxPacketSize=0x20    bInterval=8   -> 420 Bits/ms = 52500 Bytes/s
Data (HexDump)           : 01 00 00 00 12 01 00 02 FF FF FF 08 6D 04 1D C2   ............m...
                           14 40 01 02 03 01 01 01 00 06 00 02 00 00 00 01   .@..............
                           00 00 00 07 05 81 03 20 00 04 00 00 00 00 07 05   ....... ........
                           02 03 20 00 08 00 00 00 00                        .. ......

        --------------- Connection Information V2 -------------
Connection Index         : 0x01 (1)
Length                   : 0x10 (16 bytes)
SupportedUsbProtocols    : 0x03
 Usb110                  : 1 (yes, port supports USB 1.1)
 Usb200                  : 1 (yes, port supports USB 2.0)
 Usb300                  : 0 (no, port not supports USB 3.0) -> but Companion Port 1-23 does
 ReservedMBZ             : 0x00
Flags                    : 0x00
 DevIsOpAtSsOrHigher     : 0 (Device is not operating at SuperSpeed or higher)
 DevIsSsCapOrHigher      : 0 (Device is not SuperSpeed capable or higher)
 DevIsOpAtSsPlusOrHigher : 0 (Device is not operating at SuperSpeedPlus or higher)
 DevIsSsPlusCapOrHigher  : 0 (Device is not SuperSpeedPlus capable or higher)
 ReservedMBZ             : 0x00
Data (HexDump)           : 01 00 00 00 10 00 00 00 03 00 00 00 00 00 00 00   ................

    ---------------------- Device Descriptor ----------------------
bLength                  : 0x12 (18 bytes)
bDescriptorType          : 0x01 (Device Descriptor)
bcdUSB                   : 0x200 (USB Version 2.0) -> but device is Full-Speed only
bDeviceClass             : 0xFF (Vendor Specific)
bDeviceSubClass          : 0xFF
bDeviceProtocol          : 0xFF
bMaxPacketSize0          : 0x08 (8 bytes)
idVendor                 : 0x046D (Logitech Inc.)
idProduct                : 0xC21D
bcdDevice                : 0x4014
iManufacturer            : 0x01 (String Descriptor 1)
 Language 0x0409         : "Logicool"
iProduct                 : 0x02 (String Descriptor 2)
 Language 0x0409         : "Gamepad F310"
iSerialNumber            : 0x03 (String Descriptor 3)
 Language 0x0409         : "9195F557"
bNumConfigurations       : 0x01 (1 Configuration)
Data (HexDump)           : 12 01 00 02 FF FF FF 08 6D 04 1D C2 14 40 01 02   ........m....@..
                           03 01                                             ..

    ------------------ Configuration Descriptor -------------------
bLength                  : 0x09 (9 bytes)
bDescriptorType          : 0x02 (Configuration Descriptor)
wTotalLength             : 0x0030 (48 bytes)
bNumInterfaces           : 0x01 (1 Interface)
bConfigurationValue      : 0x01 (Configuration 1)
iConfiguration           : 0x00 (No String Descriptor)
bmAttributes             : 0x80
 D7: Reserved, set 1     : 0x01
 D6: Self Powered        : 0x00 (no)
 D5: Remote Wakeup       : 0x00 (no)
 D4..0: Reserved, set 0  : 0x00
MaxPower                 : 0xFA (500 mA)
Data (HexDump)           : 09 02 30 00 01 01 00 80 FA 09 04 00 00 02 FF 5D   ..0............]
                           01 00 10 21 10 01 01 24 81 14 03 00 03 13 02 00   ...!...$........
                           03 00 07 05 81 03 20 00 04 07 05 02 03 20 00 08   ...... ...... ..

        ---------------- Interface Descriptor -----------------
bLength                  : 0x09 (9 bytes)
bDescriptorType          : 0x04 (Interface Descriptor)
bInterfaceNumber         : 0x00 (Interface 0)
bAlternateSetting        : 0x00
bNumEndpoints            : 0x02 (2 Endpoints)
bInterfaceClass          : 0xFF (Vendor Specific)
bInterfaceSubClass       : 0x5D
bInterfaceProtocol       : 0x01
iInterface               : 0x00 (No String Descriptor)
Data (HexDump)           : 09 04 00 00 02 FF 5D 01 00                        ......]..

        ----------------- Unknown Descriptor ------------------
bLength                  : 0x10 (16 bytes)
bDescriptorType          : 0x21
Data (HexDump)           : 10 21 10 01 01 24 81 14 03 00 03 13 02 00 03 00 
                           
        ----------------- Endpoint Descriptor -----------------
bLength                  : 0x07 (7 bytes)
bDescriptorType          : 0x05 (Endpoint Descriptor)
bEndpointAddress         : 0x81 (Direction=IN EndpointID=1)
bmAttributes             : 0x03 (TransferType=Interrupt)
wMaxPacketSize           : 0x0020 (32 bytes)
bInterval                : 0x04 (4 ms)
Data (HexDump)           : 07 05 81 03 20 00 04                              .... ..

        ----------------- Endpoint Descriptor -----------------
bLength                  : 0x07 (7 bytes)
bDescriptorType          : 0x05 (Endpoint Descriptor)
bEndpointAddress         : 0x02 (Direction=OUT EndpointID=2)
bmAttributes             : 0x03 (TransferType=Interrupt)
wMaxPacketSize           : 0x0020 (32 bytes)
bInterval                : 0x08 (8 ms)
Data (HexDump)           : 07 05 02 03 20 00 08                              .... ..

    ----------------- Device Qualifier Descriptor -----------------
Error                    : ERROR_GEN_FAILURE  (because the device is Full-Speed only)

      -------------------- String Descriptors -------------------
             ------ String Descriptor 0 ------
bLength                  : 0x04 (4 bytes)
bDescriptorType          : 0x03 (String Descriptor)
Language ID[0]           : 0x0409 (English - United States)
Data (HexDump)           : 04 03 09 04                                       ....
             ------ String Descriptor 1 ------
bLength                  : 0x12 (18 bytes)
bDescriptorType          : 0x03 (String Descriptor)
Language 0x0409          : "Logicool"
Data (HexDump)           : 12 03 4C 00 6F 00 67 00 69 00 63 00 6F 00 6F 00   ..L.o.g.i.c.o.o.
                           6C 00                                             l.
             ------ String Descriptor 2 ------
bLength                  : 0x1A (26 bytes)
bDescriptorType          : 0x03 (String Descriptor)
Language 0x0409          : "Gamepad F310"
Data (HexDump)           : 1A 03 47 00 61 00 6D 00 65 00 70 00 61 00 64 00   ..G.a.m.e.p.a.d.
                           20 00 46 00 33 00 31 00 30 00                      .F.3.1.0.
             ------ String Descriptor 3 ------
bLength                  : 0x12 (18 bytes)
bDescriptorType          : 0x03 (String Descriptor)
Language 0x0409          : "9195F557"
Data (HexDump)           : 12 03 39 00 31 00 39 00 35 00 46 00 35 00 35 00   ..9.1.9.5.F.5.5.
                           37 00                                             7.
